:START_ID,:END_ID,:TYPE,doc_id,evidence
"Trump Administration","deregulatory agenda",MARKED_BY,"doc_31","Donald Trump's previous term as President was marked by a deregulatory agenda."
"Electric Vehicle Market","government incentives",GROWTH_TIED_TO,"doc_31","The electric vehicle market...benefited from government incentives like tax credits and subsidies."
"Electric Vehicle Market","two-million-vehicle mark in 2019",TIPPED_OVER,"doc_69","The sales of battery electric and plug-in hybrid electric cars tipped over the two-million-vehicle mark for the first time in 2019"
"Electric Vehicle Market","throughout the 2020s",EXPECTED_GROWTH,"doc_69","a pattern of continued growth, which is expected to be sustained throughout the 2020s"
"Secondary Battery Industry","withdrawal of support for electric vehicles",AFFECTED_BY,"doc_31","The potential withdrawal of support for electric vehicles not only affects the secondary battery industry."
"PHEVs and EREVs","investment in future EV share",VIEWED_AS,"doc_32","PHEVs and EREVs can be viewed as an investment in future EV share"
"Electric Vehicle (EV) market","2022",EXPECTED_GROWTH,"doc_33","The Electric Vehicle (EV) market is expected to really take off in 2022, driven by innovation in battery manufacturing."
"Germany","26%",CLOSED_YEAR_WITH_MARKET_SHARE,"doc_33","Germany, who closed the year with a 26% market shares."
"Germany","22% EVs",PREFERRED_CAR_TYPE,"doc_39","In Germany, the second most popular option is an EV (22%)"
"IDTechEx","9.6-fold increase in BEV & PHEV car sales by 2031",PREDICTS_INCREASE,"doc_33","IDTechEx predicts a 9.6-fold increase in BEV & PHEV car sales by 2031 compared to 2020."
"Battery Capacity","81% in China and Europe, 71% in the US",INCREASED_BY,"doc_33","the average pack capacity for BEV and PHEV cars has increased by 81% in China and Europe and by 71% in the US."
"Silicon","over 100× by 2031",EXPECTED_SURGE_IN_DEMAND,"doc_33","IDTechEx forecast silicon demand to surge by over 100× by 2031."
"Aluminum demand","11.9-fold by 2031",EXPECTED_INCREASE,"doc_33","IDTechEx predicts an 11.9-fold increase in aluminum demand for battery pack materials in 2031 compared to 2020."
"Copper demand","15.3-fold by 2031",EXPECTED_INCREASE,"doc_33","IDTechEx predicts a 15.3-fold increase in copper demand for battery pack materials in 2031 compared to 2020."
"ACC","silicon in NMC cathodes",INVESTIGATING_USE_OF,"doc_33","As for ACC, we are investigating the use of silicon in our NMC cathodes."
"Franchised dealers","50",SCORED,"doc_34","Franchised dealers showed a slightly improved sentiment with a score of 50."
"Independent dealers","37",SCORED,"doc_34","Independent dealers remain highly pessimistic, scoring only 37, the second-lowest in the survey’s history."
"Japan","$2.4 billion",INVESTED,"doc_34","Japan invests $2.4 billion in subsidies to boost EV battery production."
"Japan","corporate governance reforms",PARTNERED_WITH,"doc_51","Japan’s corporate governance reforms, leading to record-high buyback announcements."
"Japan","Yes",POSITIVE_MACRO_REFORMS,"doc_59","Positive macro and governance reforms in Japan"
"EV sentiment","Q3 2024",SAW_UPTICK,"doc_34","Electric vehicle (EV) sentiment saw a slight uptick in Q3 but remained below last year’s levels."
"Government-backed EV incentives","sales",POSITIVELY_IMPACTED,"doc_34","A growing number of dealers report that government-backed EV incentives are positively impacting sales."
"Cost index","77",HIT,"doc_34","Dealers cite rising operational costs as a key factor, as the cost index hit a record high of 77."
"Political climate concerns","44% of dealers",NOTED_BY,"doc_34","Political climate concerns saw a significant rise, with 44% of dealers noting it as a key factor."
"J.D. Power","29.2% of new vehicle shoppers likely to consider EVs",SURVEY_RESULT,"doc_35","the percentage of new vehicle shoppers very likely to consider a full-battery electric vehicle reached an all-time high of 29.2%"
"Electric Vehicle Owners","$150,000 in 2022",AVERAGE_INCOME,"doc_35","the average Tesla owner had a household income near $150,000 in 2022"
"Inflation Reduction Act of 2022","$7,500 for new EVs",PROVIDES_TAX_CREDITS,"doc_36","new tax credits from the Inflation Reduction Act of 2022 will provide up to $7,500 for new EVs"
"EV Market Share","10% by Q3 2023",GROWN_AT_RATE,"doc_36","the share of new sales that are plug-in electric increased... and then reached more than 10% in Q3 2023"
"McKinsey and J.D. Power","intent to purchase EVs is increasing",CONDUCTED_SURVEY,"doc_36","the latest consumer survey data by McKinsey and J.D. Power show that intent to purchase EVs is increasing"
"UAW","60% for new hires",NEGOTIATED_WAGE_INCREASE,"doc_37","UAW labor agreement negotiations, resulting in wages increases upward of 60% for new hires."
"Auto Loan Rates","8% in March 2024",AVERAGE_RATE,"doc_37","The average rate for a 48-month auto loan rose to nearly 8% in March 2024."
"Auto Industry","More than 1 million people",EMPLOYS,"doc_37","More than 1 million people work in the auto sector."
"Auto Industry","3% of real GDP growth in the U.S",CONTRIBUTES_TO,"doc_37","Vehicle purchases are also a driving force of overall consumer spending, providing about 3% of real GDP growth in the U.S."
"Auto Industry","Inflation and supply chain disruptions",FACES_CHALLENGES,"doc_37","Inflation continues to challenge the auto industry, driving up the costs of materials, and consequently, vehicle prices."
"Car Chip Shortage","COVID-19 pandemic",ORIGINATED_FROM,"doc_37","The ongoing car chip shortage, which originated during the COVID-19 pandemic."
"COVID-19 pandemic","10% year-on-year decline in emissions in the US in 2020",RESULTED_IN,"doc_54","The US reported a 10% year-on-year decline in emissions in 2020."
"Used Car Prices","Pandemic peaks",DECLINED_FROM,"doc_37","While used car prices have declined from their pandemic peaks."
"Republican Party","Electric Vehicles",OPPOSES,"doc_38","Opposition to EVs, along with the government subsidies and emissions goals designed to encourage their adoption, are becoming a key part of the Republican Party platform."
"J.D. Vance","Electric Vehicles",CRITICIZED,"doc_38","J.D. Vance has also been an outspoken critic of EVs."
"Gas Prices","46 Percent",INCREASED_BY,"doc_38","In July of this year, the average was $3.52, an increase of 46 percent from January 2021."
"Hyundai Ioniq 6","361 miles",EPA_RATED_RANGE,"doc_38","In Long Range trim, it can do an EPA-rated 361 miles to a charge."
"Electricity Cost","$0.16 per kWh",AVERAGE_PRICE,"doc_38","Americans pay on average about $0.16 per kWh."
"Gasoline Cost","$3.52 per gallon",AVERAGE_PRICE,"doc_38","Gas is now $3.52 per gallon."
"Kantar","4,000 people",SURVEYED,"doc_39","Kantar recently surveyed 4,000 people online across four countries"
"Singapore","10%",ADOPTION_RATE,"doc_39","Singapore has the highest adoption, with 10% of its drivers using EVs"
"UK","35% Hybrid",PREFERRED_CAR_TYPE,"doc_39","Hybrid cars are the preferred option for the next purchase among current car owners in the UK, with 35%"
"UK","falling used EV prices",EXPERIENCED,"doc_40","In the UK, for example, EV used car prices have fallen sharply in recent months."
"UK","Spike in 2021",EXPERIENCED_UNEMPLOYMENT_RATE,"doc_49","The unemployment rate displayed a downward trend until 2020 but experienced a spike in 2021."
"EV Owners in Singapore","44% Charging Stations",MOTIVATED_BY,"doc_39","citing the availability of charging stations (44%)"
"Potential EV Buyers in US","49% Charging Stations",CONCERNED_ABOUT,"doc_39","potential buyers in the US are most concerned about the availability of charging stations (49%)"
"EV Owners in Germany","31% Government Incentives",MOTIVATED_BY,"doc_39","one-third of EV owners in Germany were motivated by government incentives"
"Gen-Z in Singapore","42%",PERCENTAGE_CONSIDERING_EVS,"doc_39","42% in Singapore are Gen-Z (aged between 18-25)"
"Goldman Sachs","EV sales slowing globally",REPORTED_SALES,"doc_40","Sales momentum for electric vehicles (EVs) is slowing globally."
"Goldman Sachs","educational purposes only",PROVIDED,"doc_40","This article is being provided for educational purposes only."
"Kota Yuzawa","bear case for EV sales becoming more likely",PREDICTS,"doc_40","Goldman Sachs Research analyst Kota Yuzawa says the team’s bear case for EV sales is becoming more likely."
"Chinese EV makers","Japanese brands",POSES_THREAT_TO,"doc_40","Chinese EV makers do pose a major threat to Japanese brands."
"HEVs","payback period compared to EVs",ADVANTAGE_IN,"doc_40","HEVs have a significant advantage in payback period compared to EVs."
"Southeast Asia","Chinese EVs",MAJOR_EXPORT_DESTINATION_FOR,"doc_40","The Southeast Asia market has been a major export destination for Chinese EVs since 2023."
"EV sales volume","21% year-over-year in 2024",EXPECTED_TO_RISE,"doc_40","Despite the current slowdown in EVs, our base-case scenario still calls for EV sales volume to rise 21% year-over-year in 2024."
"Investment opportunities","automakers with strong balance sheets",FOCUSED_ON,"doc_40","At the same time, he sees investment opportunities in automakers with strong balance sheets."
"SEIA","1974",FOUNDED_IN,"doc_41","Founded in 1974, SEIA is the national trade association for the solar and solar + storage industries."
"Texas","$29.5 billion",REPORTED_SALES,"doc_41","pay Texas landowners $29.5 billion over the projects’..."
"Texas","2.4 GW",INSTALLED_CAPACITY,"doc_41","Texas led all states in new installations in Q3 2024 with 2.4 GW of new installed capacity."
"Solar+Storage","28% by 2028",EXPECTED_GROWTH,"doc_41","By 2028, 28% of all new distributed solar capacity will be paired with storage..."
"Solar Industry","219 GW",INSTALLED_CAPACITY,"doc_41","There are now over 219 gigawatts (GW) of solar capacity installed nationwide..."
"Solar Industry","26%",ANNUAL_GROWTH_RATE,"doc_41","In the last decade, solar deployments have experienced an average annual growth rate of 26%."
"Solar Prices","40%",DECLINED_BY,"doc_41","The cost to install solar has dropped by nearly 40% over the last decade..."
"DHS","29 China-based companies",ADDED_ENTITIES_TO_LIST,"doc_42","DHS announced the addition of 29 China-based companies to the Uyghur Forced Labor Prevention Act (UFLPA) Entity List."
"Biden","Xi Jinping",MET_WITH,"doc_42","Biden and Xi Meet at the APEC Summit in Lima, Peru."
"Biden","US-China relations",ADDRESSING_KEY_ISSUES,"doc_42","Biden and Xi engaged in a candid two-hour discussion addressing key issues in US-China relations."
"Chinese EV manufacturers","battery chemistry",INNOVATE_IN,"doc_43","Chinese enterprises have made important breakthroughs in battery chemistry."
"Chinese EV manufacturers","battery chemistry",INNOVATE_IN,"doc_66","Chinese enterprises have made important breakthroughs in battery chemistry."
"Chinese EV manufacturers","vehicle technology",LEAD_IN,"doc_43","Chinese enterprises are leading in other aspects of vehicle technology."
"Chinese EV manufacturers","vehicle technology",LEAD_IN,"doc_66","Chinese enterprises are leading in other aspects of vehicle technology."
"Chinese EV manufacturers","10 million EV units in 2024",PRODUCE,"doc_43","The now more than 200 EV manufacturers operating in China will produce an estimated 10 million EV units in 2024."
"Americans","59%",OPPOSE_PHASE_OUT_GAS_VEHICLES,"doc_44","About six-in-ten Americans (59%) say they oppose this [phasing out gas-powered vehicles]."
"Americans","auto parts and repairing cars",EMPLOYED_IN,"doc_50","Far more Americans are employed making auto parts and repairing cars than in assembling vehicles."
"Democrats","64%",FAVOR_PHASE_OUT_GAS_VEHICLES,"doc_44","Currently, a majority of Democrats (64%) favor phasing out production of gas-powered vehicles by 2035."
"Republicans","84%",OPPOSE_PHASE_OUT_GAS_VEHICLES,"doc_44","Currently, 84% of Republicans oppose phasing out production of gas-powered vehicles by 2035."
"Public Confidence","17% extremely or very confident",CONFIDENCE_IN_EV_INFRASTRUCTURE,"doc_44","Some 17% say they are extremely or very confident this will happen [building necessary infrastructure for EVs]."
"EV Owners","Most",CHARGE_AT_HOME,"doc_44","Currently, most EV owners charge their vehicles at home."
"EV Owners","Fuel Costs",SAVE_ON,"doc_62","EV owners who charged at home would have saved an average of $81 per month compared with owning a traditional ICE vehicle."
"Pew Research Center","10,329 U.S. adults",CONDUCTED_SURVEY,"doc_44","Pew Research Center conducted this study to understand Americans’ views on electric vehicles. We surveyed 10,329 U.S. adults from May 30 to June 4, 2023."
"Robert Heppenstall","American Airlines",WORKED_AT,"doc_45","I am a versatile leader with over 15 years of experience spanning loyalty program design,… · Experience: American Airlines"
"Robert Heppenstall","The University of Texas",EDUCATED_AT,"doc_45","Education: The University of Texas"
"Robert Heppenstall","4 people",RECOMMENDED_BY,"doc_45","4 people have recommended Robert"
"Delta Air Lines","Customer Experience Design",PARTNERED_WITH,"doc_45","Customer Experience Design at Delta Air Lines"
"Airline Industry","Federal Aviation Administration",REGULATED_BY,"doc_45","The airline industry's perception is pretty bad."
"Airline Industry","Negative",HAS_PERCEPTION,"doc_45","The perception of your business or industry directly affects your advertising costs and effectiveness."
"Airlines","Personalized Marketing",REPORTED_SALES,"doc_45","Airlines Looking to Use Personalized Marketing in Seatbacks and In-Flight Apps."
"Rob","Incredible leader",DESCRIBED_AS,"doc_45","Rob is a great strategist, thinker, doer and leader."
"Energy Consumption","Electric Power Sector",INCLUDES,"doc_46","Energy use in homes, commercial buildings, manufacturing, and transportation."
"Renewable Energy","Hydropower, Solar, Wind, Geothermal, Biomass, Ethanol",INCLUDES,"doc_46","Includes hydropower, solar, wind, geothermal, biomass and ethanol."
"Greenhouse Gas Data","EIA",REPORTED_BY,"doc_46","Greenhouse gas data, voluntary reporting, electric power plant emissions."
"Energy Prices","Petroleum, Natural Gas, Coal, Electricity, Nuclear Energy",INCLUDES,"doc_46","This publication includes total energy production, consumption, stocks, and trade; energy prices; overviews of petroleum, natural gas, coal, electricity, nuclear energy, and renewable energy."
"Energy Prices","Yes",EXPECTED_TO_REMAIN_ELEVATED,"doc_59","oil prices are expected to remain elevated"
"Charge Points in the US","35 million by 2030",FORECASTED_TO_RISE_TO,"doc_48","The number of charge points in the US is forecast to rise from about 4 million currently to 35 million in 2030."
"CPOs","65% of market value by 2040",ESTIMATED_TO_ACCOUNT_FOR,"doc_48","CPOs are estimated to account for the bulk of the market’s value from roughly half currently to 65% in 2040."
"Residential Chargers","EV sellers by 2030",FORECASTED_TO_BE_SOLD_BY,"doc_48","By 2030, 70% of residential chargers will be sold by EV sellers."
"EV Charging Market","Tenfold by 2030",EXPECTED_TO_GROW,"doc_48","The EV charging market could — and will need to — grow nearly tenfold to satisfy the charging needs of an estimated 27 million EVs on the road by 2030."
"At-work Charging Segment","17% of the market by 2030",EXPECTED_TO_GROW_TO,"doc_48","The fastest-growing charging segment is expected to be the at-work segment, set to grow from nearly zero percent to about 17% by 2030."
"EVSE Startups","Rapid maturation of the industry",SIGNALING,"doc_48","The proliferation of EVSE startups and the growth of the sector is signaling that we’re entering a period of a rapid maturation of the industry."
"UK Economy","Shortages and Bottlenecks",EXPERIENCED_INFLATION,"doc_49","Economic demand rebounded at a faster pace than supply, leading to shortages, bottlenecks, and inflation."
"Trade","Post-Brexit and COVID-19",SUFFERED_DECLINE,"doc_49","Notably, trade experienced the most significant decline following both Brexit and the COVID-19 pandemic."
"Wales","Brexit and COVID-19",AFFECTED_BY,"doc_49","Wales and Northern Ireland emerged as the regions most affected by Brexit and COVID-19."
"Finance Industry","UK GDP",CONTRIBUTED_TO,"doc_49","Industries such as finance, science, and health demonstrated an increased contribution to the UK’s total GDP in the post-Brexit period."
"UK Government","Economic Research",RECEIVED_INSIGHTS_FROM,"doc_49","The findings of this research carry significant value for the UK government and businesses."
"British Pound","Near Future",ANTICIPATED_DEPRECIATION,"doc_49","The British currency, the pound, is anticipated to face significant depreciation in the near future."
"EU","Inflation Reduction Act",REGULATED_BY,"doc_50","EU-US relations after the Inflation Reduction Act"
"EU","United States",PARTNERED_WITH,"doc_50","EU-US relations after the Inflation Reduction Act"
"auto industry","electric vehicles",TRANSITION_TO,"doc_50","The needed transition from an auto industry based on gas..."
"electric vehicles","gas vehicles",REPLACED_BY,"doc_50","The needed transition from an auto industry based on gas..."
"auto parts","increased employment",MARKET_SIZE,"doc_50","Far more Americans are employed making auto parts..."
"India","strong earnings momentum",EXPECTED_GROWTH,"doc_51","India is expected to maintain strong earnings momentum due to falling rates and robust services export growth."
"Mexico","United States",REGULATED_BY,"doc_51","The U.S. may intensify efforts to limit the passage of Chinese products through Mexico."
"Taiwan","AI infrastructure build-out",BENEFITS_FROM,"doc_51","Taiwanese companies, as key beneficiaries of the AI infrastructure build-out."
"European Central Bank","businesses relying on bank lending",SUPPORTS,"doc_51","Additional European Central Bank (ECB) easing should eventually provide some support, especially for businesses that rely more on bank lending."
"Electric Vehicle Supply Chain","renewable energy",LINKED_TO,"doc_51","Pockets of opportunities do exist, particularly among private companies prioritizing shareholder returns and belonging to innovative sectors linked to business technology or the renewable energy and electric vehicle supply chain."
"Bitcoin ETPs","First-year market demand",REPORTED_SALES,"doc_52","Discover the first-year market demand and investor trends of bitcoin ETPs, and what the future may hold."
"Fed outlook 2025","Monetary policies",REGULATED_BY,"doc_52","Explore the Fed outlook for 2025. Gain insights into expected monetary policies and market projections to help guide your investments."
"AI and geopolitics","Investment opportunities",FORGE_NEW_PATHS,"doc_52","Dive into thematic ETFs and learn how AI, geopolitics, and recent rate cuts are reshaping investment opportunities."
"Gold and oil","Investors",EFFECTIVE_HEDGING_TOOLS,"doc_52","Discover gold and oil’s potential as hedging tools amid market volatility and geopolitical uncertainty."
"Investors","Strong Economy",INCREASED_RISK_APPETITE,"doc_60","Under the strong economy, the risk appetite of investors has ..."
"Investors","Market Sentiment",INFLUENCED_BY,"doc_60","Under the strong economy, the risk appetite of investors has ..."
"BlackRock Flexible Income ETF (BINC","Active ETFs",ENHANCES_PORTFOLIO_PERFORMANCE,"doc_52","Discover the potential benefits of the BlackRock Flexible Income ETF (BINC), and how it seeks to manage risks and capitalize on market opportunities."
"Bitcoin volatility","Long-term investing",TRENDS_INSIGHTS,"doc_52","Explore the journey of bitcoin's volatility, from turbulent beginnings to a promising decline. Learn how these trends affect long-term investing."
"Neuroscience and AI","Healthcare sector",FINDING_INVESTMENT_OPPORTUNITIES,"doc_52","We analyze the ways in which innovation and digitization come together to brighten the outlook for the healthcare sector."
"Energy Sector Stocks","Is Now",INVESTS_IN,"doc_53","Energy Sector Stocks: Is Now the Time to Invest?"
"Rob Haworth","S&P",GREW_OR_INCREASED,"doc_53","Energy stocks significantly lagged the broader S&P 500, which gained 25% in 2024.1 On the strength of standout performance prior to 2023, the energy sector is up more than 20% per year for the three-year period ending December 2024, and 12.14% per year over the previous five years.1 “As 2024 came to a close, markets responded to the environment for energy prices,” says Rob Haworth, senior investment strategy director with U.S. Bank Asset Management."
"Rob Haworth","S&P",GREW_OR_INCREASED,"doc_53","Natural gas companies make up roughly one-third of the S&P 500 Energy index.1 “The oil market is one that remains well supplied but isn’t well demanded,” says Rob Haworth, senior investment strategy director for U.S. Bank Asset Management."
"Rob Haworth","S&P",GREW_OR_INCREASED,"doc_53","In the U.S., renewables make up less than 25% of all electricity generation.6 “Alternatives like wind and solar are not a factor in the S&P 500 Energy Index to this point,” says Rob Haworth, senior investment strategy director at U.S. Bank Asset Management."
"Rob Haworth","United States",GREW_OR_INCREASED,"doc_53","Energy stocks significantly lagged the broader S&P 500, which gained 25% in 2024.1 On the strength of standout performance prior to 2023, the energy sector is up more than 20% per year for the three-year period ending December 2024, and 12.14% per year over the previous five years.1 “As 2024 came to a close, markets responded to the environment for energy prices,” says Rob Haworth, senior investment strategy director with U.S. Bank Asset Management."
"Rob Haworth","United States",GREW_OR_INCREASED,"doc_53","Natural gas companies make up roughly one-third of the S&P 500 Energy index.1 “The oil market is one that remains well supplied but isn’t well demanded,” says Rob Haworth, senior investment strategy director for U.S. Bank Asset Management."
"Rob Haworth","United States",GREW_OR_INCREASED,"doc_53","Rob Haworth, senior investment strategy director at U.S. Bank Asset Management says bottom line results for companies can hold up even if oil prices don’t."
"Rob Haworth","United States",GREW_OR_INCREASED,"doc_53","In the U.S., renewables make up less than 25% of all electricity generation.6 “Alternatives like wind and solar are not a factor in the S&P 500 Energy Index to this point,” says Rob Haworth, senior investment strategy director at U.S. Bank Asset Management."
"S&P","United States",GREW_OR_INCREASED,"doc_53","Energy stocks significantly lagged the broader S&P 500, which gained 25% in 2024.1 On the strength of standout performance prior to 2023, the energy sector is up more than 20% per year for the three-year period ending December 2024, and 12.14% per year over the previous five years.1 “As 2024 came to a close, markets responded to the environment for energy prices,” says Rob Haworth, senior investment strategy director with U.S. Bank Asset Management."
"S&P","United States",GREW_OR_INCREASED,"doc_53","Natural gas companies make up roughly one-third of the S&P 500 Energy index.1 “The oil market is one that remains well supplied but isn’t well demanded,” says Rob Haworth, senior investment strategy director for U.S. Bank Asset Management."
"S&P","United States",GREW_OR_INCREASED,"doc_53","But renewables make up less than 25% of U.S. electricity generation.6 “Alternatives like wind and solar are not a factor in the S&P 500 Energy Index to this point,” says Haworth."
"S&P","United States",GREW_OR_INCREASED,"doc_53","In the U.S., renewables make up less than 25% of all electricity generation.6 “Alternatives like wind and solar are not a factor in the S&P 500 Energy Index to this point,” says Rob Haworth, senior investment strategy director at U.S. Bank Asset Management."
"OPEC","Oil Petroleum Exporting Countries",GREW_OR_INCREASED,"doc_53","“In part, it reflects concern that Oil Petroleum Exporting Countries+ (OPEC+) may soon boost production, which would add to an already solid supply situation.” Haworth notes that energy demand remains an issue."
"OPEC","The U.S",GREW_OR_INCREASED,"doc_53","As a result, global demand is lagging.” The U.S. is now the world’s largest oil producer, with current production reaching record levels.3 Supply interruptions occurred worldwide as OPEC+ trimmed production levels to boost oil prices."
"OPEC","United States",GREW_OR_INCREASED,"doc_53","As a result, global demand is lagging.” The U.S. is now the world’s largest oil producer, with current production reaching record levels.3 Supply interruptions occurred worldwide as OPEC+ trimmed production levels to boost oil prices."
"Change Year-to-Date Crude Oil","End Price Recent Price",GREW_OR_INCREASED,"doc_53","Oil prices moved above $80/barrel by mid-March 2024, then held between $70 and $80/barrel for much of 2024’s summer months but have hovered in the $70/barrel range since September.2 Natural gas prices rose more than 30% in 2024, but prices for all key energy products remain significantly below 2022 peaks.2 Category 2022 Peak Price 2023 End Price Recent Price % Change from Peak % Change Year-to-Date Crude Oil (barrel) $123.64 $71.89 $72.44 -41.4% 0.8% Gasoline (gallon) $5.01 $3.12 $3.00 -40.0% -3"
"Change Year-to-Date Crude Oil","Natural Gas",GREW_OR_INCREASED,"doc_53","Oil prices moved above $80/barrel by mid-March 2024, then held between $70 and $80/barrel for much of 2024’s summer months but have hovered in the $70/barrel range since September.2 Natural gas prices rose more than 30% in 2024, but prices for all key energy products remain significantly below 2022 peaks.2 Category 2022 Peak Price 2023 End Price Recent Price % Change from Peak % Change Year-to-Date Crude Oil (barrel) $123.64 $71.89 $72.44 -41.4% 0.8% Gasoline (gallon) $5.01 $3.12 $3.00 -40.0% -3"
